Мои первые школьные прописи. В 4 ч. Ч. 4,978-5-17-069828-8,32,65 х 210 x 2 мм,0.057,"""Мои первые школьные прописи"" - пособие с поурочным планированием, состоящее из  4-х частей.     Представленные задания - ""обведи элементы букв"", ""пропиши букву"", ""выдели орфограмму"", списывание с печатного текста, письмо под диктовку - необходимы для отработки каллиграфического почерка и развития мелкой моторики. Каждая буква алфавита дана в виде нескольких простых элементов. На первом этапе ученик обводит напечатаные элементы букв, затем пишет их самостоятельно. Работа по этим прописям даёт очень высокие результаты. Прописи можно использовать для коллективной работы в классе и для индивидуальной работы дома."Мой ребенок с удовольствием ходит в детский сад!,978-5-17-102718-6,224,30 х 206 x 15 мм,0.244,"Анна Быкова — талантливый педагог, практикующий психолог, мама двух сыновей, ее советам по воспитанию доверяют более 10 тысяч родителей!В этой книге вы найдете ответы на очень важные вопросы, от которых зависит — ни много ни мало — счастье ребенка, его нормальное психическое развитие:— как облегчить ребенку расставание с мамой;— как быстрее адаптироваться к детскому саду — не только ребенку, но и родителям;— как научиться спокойно реагировать на детские слезы, истерики, отсутствие аппетита, нежелание оставаться с ""чужой тетей"";— что на самом деле происходит с ребенком в детском саду.А еще о важности новых трусов, постоянстве и маминых тревогах.Практический опыт, реальные истории, бесценные советы!"Мойдодыр и другие сказки,978-5-17-106699-4,64,63 х 210 x 7 мм,0.13,"Эта книжка посвящается всем тем ребятам, которые не любят мыться и умываться. Они пока не знают, что их ожидает. А ожидает их встреча с Мойдодыром, который обладает крутым нравом и расправляется с грязнулями одной левой!Дети сами с удовольствием прочитают эту книжку сказок К. Чуковского, ведь здесь крупный шрифт и все слова с ударениями. А небольшой формат и объем книги позволят взять её с собой в дорогу!"Муми-тролли и самый последний на свете дракон,978-5-17-120515-7,32,15 х 290 x 8 мм,0.415,В последний день лета Муми-тролль поймал дракона - самого последнего дракона на Земле! Но как приручить его? Как сделать своим другом? Вдруг это опасно? Муми-троллю предстоит сделать нелёгкий выбор.Истории о муми-троллях и других обитателях Муми-дола знают и любят по всему миру уже долгие годы. Классический оригинальный рассказ Туве Янссон о дружбе теперь адаптирован специально для малышей.Почему зебры полосатые?,978-5-17-116150-7,48,60 х 210 x 5 мм,0.1,"Удивительно устроена природа: только что мы видели прекрасную бабочку – и вдруг она сложила крылышки и стала незаметна! Многие звери, птицы, рыбы умеют так слиться с окружающей средой, что их сразу не найдёшь. О секретах их маскировки расскажет Петра Волцита ""Почему зебры полосатые?"".Для младшего школьного возраста."Почему небо голубое?,978-5-17-115477-6,48,61 х 210 x 4 мм,0.098,"                                                                                            Увлекательный рассказ о солнце, цвете, темноте и зрении для младших школьников! Знаете ли вы, какой путь проделывает луч света, чтобы мы видели мир цветным и ярким? Сколько всего существует цветов? А оттенков? Какой художник мог видеть ультрафиолет? Эта книга расширит кругозор ребёнка и даст научно обоснованные ответы на все детские вопросы о свете и цвете, на которые порой затрудняются ответить и взрослые! Автор книги – кандидат физико-математических наук, популяризатор науки А. Ворох – ведет с читателем непринужденную беседу на равных, объясняя сложные понятия простым языком.                                                                                    "Приключения викинга Таппи из Шептолесья,978-5-17-114950-5,176,43 х 205 x 15 мм,0.332,"Если ты хочешь заглянуть в Избушку Таппи, послушать истории Сказителя, рассказанные им в одну звёздную ночь, познакомиться с великаном Скалвалуном и узнать, какие чары навела на него Скрипильда, и даже поиграть в догонялки с Вихрем, мы приглашаем тебя в Шептолесье…В прекрасном, волшебном Шептолесье живёт симпатичный викинг Таппи. У него много друзей, таких же сказочных, как и он. Среди них тебе встретятся олень Хиххи и ворон Говорунд, охотник Хасте и кузнец Сигурд, эльфы и древние духи леса — Дедушка Водопад и дуб Стародей…Но встретишь ты и злого ярла Свирепуса, живущего у Последнего моря. В замке, построенном на спине у кита, он запер в темнице Сигурда.Таппи и его друзья немедленно отправились в опасное путешествие, чтобы освободить кузнеца. В дороге их ждало множество опасных приключений, из которых они вышли целыми и невредимыми…Волшебный лес помогает тем, у кого добрые сердца…"Прописи для дошколят. Учимся писать,978-5-17-101550-3,64,97 х 256 x 6 мм,0.18,"                                                                                            Это замечательное пособие поможет малышу научиться правильно писать все буквы русского алфавита, развить мелкую моторику, графические навыки и внимание. Книга станет незаменимым помощником в подготовке будущего ученика к школе.                                                                                    "Простые упражнения для обучения чтению,978-5-17-109376-1,32,97 х 255 x 3 мм,0.11,"                                                                                            В книгах серии вы найдете:	специально подобранные упражнения для детей, которые только учатся читать;	простые слова и несложные предложения; 	увлекательные короткие тексты;	крупный шрифт и яркие красочные картинки. В книге «Простые упражнения для обучения чтению» собраны интересные и эффективные задания, выполняя которые ребенок сможет не только закрепить навыки чтения, но и познакомиться с азами грамматики.                                                                                    "Путешествие викинга Таппи по Бурлящим морям,978-5-17-114951-2,176,42 х 206 x 15 мм,0.328,"Викинг Таппи любит родное Шептолесье и своих друзей. Но со дня своего последнего приключения в Ледовом заливе он мечтает о далёких странствиях. Вместе с друзьями он строит корабль и в компании с оленёнком Хиххи отправляется в путешествие по Бурлящим морям.В море Таппи и Хиххи ждёт множество невероятных приключений. Они находят новых друзей: тролля Бурчи, кита Раздума, великана Валунни и эльфийку Светильду. На их пути встают злой чародей Торбул и гигантский дракон Надулгуб. И тогда становится немного опасно... К счастью, у Таппи огромное сердце и много друзей, благодаря которым он находит выход из любой сложной ситуации."Самая хитрая рыба,978-5-17-119259-4,448,32 х 208 x 29 мм,0.395,"	Что делать, если рядом с вами поселился убийца?	Не следите за ним.	Не злите его.	Не ссорьтесь.	Но главное — не давайте ему понять, что вы что-то знаете.Что делать, если вы нарушили одно из правил?БЕГИТЕ"Самые лучшие сказки,978-5-17-107529-3,192,05 х 265 x 19 мм,0.77,"В книгу великого отечественного детского писателя и сказочника Корнея Чуковского вошли сказки в прозе длясамых маленьких ""Цыплёнок"", ""Так и не так"" и сказки в стихах ""Муха-Цокотуха"", ""Айболит"", ""Мойдодыр""и другие. Яркие сказочные персонажи путешествуют в фантастических невероятных историях К. Чуковского.Их динамичные сюжеты заставляют читателей самых разных поколений не отрываясь следить за их развитием.Присоединяйтесь!"Сказки в картинках В. Сутеева,978-5-17-102497-0,96,04 х 264 x 12 мм,0.409,"""Сказки в картинках В. Сутеева"" – это сборник произведений писателей-классиков, которые любят и знают не только мамы и папы, но и бабушки и дедушки малышей. Кто же не помнит усатого-полосатого котёнка С. Маршака, упрямого Лягушонка С. Михалкова, Мойдодыра К. Чуковского, котёнка по имени Гав Г. Остера, медвежонка-невежу А. Барто и других знаменитых героев детской литературы. Теперь и ваши малыши смогут сами прочитать и подружиться с этими героями, ведь в этой книге для самостоятельного чтения большие буквы и все слова разбиты на слоги с ударениями. А все картинки в книге нарисованы мастером детской иллюстрации В. Сутеевым, картинки которого любят и дети, и взрослые."Сказки дедушки Корнея,978-5-17-094674-7,128,05 х 265 x 13 мм,0.488,"                                                                                            В сборник «Сказки дедушки Корнея» вошли пять экранизированных историй Корнея Чуковского — легендарного отечественного детского писателя, книги которого ежегодно издаются миллионными тиражами. Среди них — «Телефон», «Мойдодыр», «Федорино горе», «Айболит» и «Крокодил». ...Врач не справляется с работой из-за вечно звонящего телефона. Умывальник борется с мальчишкой-грязнулей. От неряшливой бабушки убегает посуда. Добрый доктор преодолевает горы и моря, чтобы вылечить африканских зверят. А отважный мальчуган спасает город от бандита-крокодила...Над изданием для дошкольников работал именитый отечественный художник Владимир Сутеев — автор канонических изображений персонажей Корнея Чуковского, Сергея Михалкова и Самуила Маршака. Родители помнят его рисунки с детства: они украшали стены детсадов и поликлиник, посуду и одежду.                                                                                    ""Сладость на корочке пирога + Сорняк, обвивший сумку палача",978-5-17-114348-0,640,40 х 220 x 35 мм,0.598,"                                                                                            Премия «Кинжал Дебютанта» от Британской ассоциации писателей-криминалистов и одна из самых престижных премий детективной литературы –  «Премия Агаты», утвержденная в честь Агаты Кристи. Самое начало серии о невероятных приключениях Флавии де Люс. Два легендарных романа под одной обложкой: «Сладость на корочке пирога» и «Сорняк, обвивший сумку палача».Идеальный подарок всем любителям неожиданных остросюжетных детективов.Старая добрая Англия, пятидесятые годы двадцатого века. Тишина и покой. Ухоженные поля, утопающие в зелени усадьбы, медленно вращающие свои лопасти мельницы и запах корицы. В поместье Букшоу живет полковник Лоуренс де Люс со своими дочерями, Офелией, Дафной и одиннадцатилетней Флавией, которой и предстоит стать главной героиней всей серии. Она умна, харизматична, обожает химию и не лезет за словом в карман. Идеальный герой для любой детективной истории. В первом, дебютном романе Флавии предстоит расследовать смерть незнакомца, который пришел к ее отцу, угрожал ему, а затем был найден мертвым на огуречной грядке. Естественно, полиция стремится посадить Лоуренса, но Флавия уверена – отец не защищает себя, чтобы защитить их. Второе дело окажется ничуть не проще первого. В романе «Сорняк, обвивший сумку палача» Флавии предстоит найти убийцу мальчика, повесившегося в соседнем лесу несколько лет назад. Об этом событии никто бы не вспомнил, если бы одна из кукол на представлении бродячих музыкантов не была идеально похожа на погибшего ребенка.                                                                                    "Следствие ведут Колобки,978-5-17-106945-2,160,05 х 265 x 17 мм,0.671,"                                                                                            Самый детский детектив от самого детского автора – Эдуарда Успенского, создателя «Крокодила Гены» и историй про Простоквашино. На сей раз герои книги – детективы-колобки из «Пункта Добрых Дел» – берутся за расследование самых разных преступлений: от похищения ста порций мороженого до предотвращения крупного преступного заговора. Известная художница Надежда Богуславская, работавшая над книгами Астрид Линдгрен и Сергея Михалкова, очень точно передала настроение истории: серьезно о несерьезном. Книга увлечет даже самого активного ребёнка – вместе с забавными героями он будет искать ответы и разгадывать тайны! Для детей младшего школьного возраста.                                                                                    "Собачье сердце,978-5-17-119737-7,352,22 х 187 x 25 мм,0.297,"В эту книгу вошли три повести Михаила Булгакова, настоящие шедевры его фантасмагорической сатиры: ""Роковые яйца"", притягивающие своей причудливостью и остроумием, и оказавшие огромное влияние на множество поколений российских читателей, раздерганное на цитаты, блестяще экранизированное Владимиром Бортко ""Собачье сердце"", а также повесть ""Дьяволиада"", которую литературоведы считают своеобразным эскизом, или наброском к бессмертному роману ""Мастер и Маргарита""."Собор Парижской Богоматери,978-5-17-096559-5,512,30 х 205 x 22 мм,0.365,"""Собор Парижской Богоматери"" - величайший исторический роман. Книга, в которой увлекательный, причудливый сюжет - всего лишь прекрасное обрамление для поразительных, потрясающих воображение авторских экскурсов в прошлое Парижа. Книга, в которой каждый читатель найдет что-то свое... ""Собор Парижской Богоматери"" экранизировали и ставили на сцене десятки раз, однако ни одной из постановок не удалось до конца передать масштаб и величие оригинала Гюго."Счастье Муры,978-5-17-121801-0,112,67 х 218 x 13 мм,0.34,"Самых счастливых девочек в мире зовут Мурами, это мы знаем совершенно точно. У девочек Мур добрые дедушки, заботливые бабушки, любящие мамы и папы. А также шебутные старшие братья, которые немного портят мирное течение жизни, но это они нечаянно, не со зла. Приключений тоже у девочек Мур столько, что хоть отбавляй. Не верите? Прочитайте книжку и сами во всём убедитесь. Это будет смешное чтение. И совсем капелюшечку — горькое. Потому что жизнь — она разная. Как ни крути."Тренажер для обучения чтению,978-5-17-109820-9,32,97 х 255 x 5 мм,0.106,"                                                                                            В книгах серии вы найдете:	специально подобранные упражнения для детей, которые только учатся читать;	простые слова и несложные предложения; 	увлекательные короткие тексты;	крупный шрифт и яркие красочные картинки. В книге «Тренажер для обучения чтению» собраны разнообразные увлекательные задания, с помощью которых ребенок отработает технику чтения, научится читать сложные слова и составлять словосочетания, а также потренирует речь, внимание и мышление.                                                                                    "Удивительный волшебник из страны Оз. Графический роман,978-5-17-114850-8,224,70 х 270 x 17 мм,0.757,"	Знаменитый комиксист Скотти Янг представляет адаптацию самой известной сказки Л. Фрэнка Баума «Удивительный Волшебник из страны Оз». Маленькую девочку Дороти из Канзаса ураганом занесло в страну Оз. В этом удивительном мире она встречает Страшилу, Железного дровосека и Трусливого льва. Куда приведёт их жёлтая кирпичная дорога и сможет ли Дороти вернуться домой? Почувствуйте совершенно новую атмосферу сказки благодаря мастерству Скотти Янга."