Что течёт по проводам?,978-5-17-115474-5,48,62 х 210 x 5 мм,0.098,"                                                                                            Увлекательный рассказ об электричестве и его свойствах для младших школьников! Компьютер, чайник, утюг, смартфон – эти и многие другие повседневные приборы не могут работать без электричества. Но откуда оно берётся и как доходит до квартир? Где «производят» электричество? Какие ученые изобрели батарейку, генератор, лампочку? Эта книга расширит кругозор ребёнка и даст научно обоснованные ответы на все детские вопросы об электричестве, на которые порой затрудняются ответить и взрослые! Автор книги, детский писатель В. Малов – ведет с читателем непринужденную беседу на равных, объясняя сложные понятия простым языком.                                                                                    "Чудесная страна Оз. Графический роман,978-5-17-114849-2,200,68 х 268 x 14 мм,0.715,"	Мало кто знает, но у легендарной сказки «Удивительный Волшебник из Страны Оз» есть продолжение и не одно. Фрэнк Баум написал больше, чем один сиквел — он создал целый мир удивительной страны Оз. В общей сложности у Баума набралось за жизнь четырнадцать полноценных романов и несколько коротких рассказов.	«Чудесная страна Оз. Графический роман» от талантливого художника MARVEL Скотти Янга — это продолжение классической сказки. Но уже не про Дороти, которая стремится найти волшебника и попасть домой, а про нового героя Типа.	В этом сиквеле нас ждет еще больше магии от злых и добрых колдуний, женские армии, которые борются за власть и Страшила в роли короля Изумрудного города. Помимо старых героев, мы повстречаем и новых: Тыквоголового Джека, деревянные Козлы и Профессора Жука‑Скакуна."С неба упали три яблока (2-е изд.),978-5-17-091621-4,320,30 х 207 x 18 мм,0.281,"	История одной маленькой деревни, затерянной высоко в горах, и ее немногочисленных обитателей, каждый из которых немножко чудак, немножко ворчун и в каждом из которых таятся настоящие сокровища духа."