"Беспокойная мама, или Приключения храброго поросёнка",978-5-17-116102-6,32,04 х 265 x 10 мм,0.355,"""В лесу ужасно страшно! - сказала мама-свинка. - Там скрываются чудовища. А ещё там можно утонуть в бурлящем ручье! Или заблудиться…"" Девять маленький поросят испуганно нахмурились и закрыли маленькими розовыми ушками глаза от страха. И только десятый поросёнок оживился и захохотал. В лесу ждут приключения? Тогда нужно срочно туда отправиться! И маленький бунтарь потихоньку уходит, чтобы доказать себе и всем вокруг - в лесу не так уж и страшно!Гунди Хергет после обучения в Мюнхенском, а затем и в Пизанском университетах начала работать редактором, занимаясь такими направлениями, как бизнес, развлеченияи путешествия. В 2009 году у неё появился сын, а спустя совсем немного времени Гунди Хергет поняла, что просто обожает детскую литературу. Она начала писать сама, и вот в 2014 году её книга уже была номинирована на Oldenburger Kinderund Jugendbuchpreis.""Приключения храброго поросёнка "" - история про победу любопытства над страхами."Как лодка подводной стала?,978-5-17-096784-1,48,62 х 210 x 4 мм,0.099,"Каждый из нас хотя бы раз видел настоящую моторную лодку или вёсельную шлюпку, парусную яхту или теплоход. Тем, кто живёт около больших рек или на морском берегу, это не в диковинку. А видел ли кто-нибудь ""живьём"" подводную лодку? Таких счастливчиков наберётся немного. Книга Андрея Богдарина ""Как лодка подводной стала?"" познакомит вас с самыми разными подводными лодками, расскажет, как они устроены, как ""видят"" и ""слышат"" под водой, какие субмарины строили при Петре I, что такое батискаф и как выглядел первый акваланг. Будет интересно!"Как полететь в космос?,978-5-17-116794-3,48,61 х 210 x 4 мм,0.101,"Книга Александра Монвиж-Монтвида ""Как полететь в космос?"" познакомит читателей с историей космонавтики, расскажет, когда начали конструировать первые ракеты и спутники, как велась подготовка космонавтов к полёту, какие животные помогали людям в изучении космоса. Почему ракеты делают многоступенчатыми? Волновался ли Юрий Гагарин перед полётом? Что происходит с различными предметами в невесомости? На эти и многие другие вопросы ты найдёшь ответы в этой книге.Для младшего школьного возраста."Как устроен человек?,978-5-17-115475-2,48,61 х 210 x 5 мм,0.095,"                                                                                            Увлекательный рассказ об анатомии человека для младших школьников! Как отдыхает сердце? Что такое давление и как измерить пульс? Какие кости составляют скелет и что такое нервная система? Эта книга расширит кругозор ребёнка и даст научно обоснованные ответы на все детские вопросы, на которые порой затрудняются ответить и взрослые! Автор книги – врач В. Иванова – ведет с читателем непринужденную беседу на равных, объясняя сложные понятия простым языком.                                                                                    "Как устроено моё тело?,978-5-17-119196-2,32,62 х 210 x 3 мм,0.085,"Как устроены глаза и уши? Сколько костей в скелете человека? Правда ли, что кожа, кровь и органы тела состоят из крошечных частичек – клеток? Страницы этой книги отправят читателя в самое удивительное, увлекательное и познавательное путешествие по необычайно богатому ""внутреннему миру"" человека. Вы узнаете, за что отвечает мозг человека, как мы чувствуем вкус и запах, почему важно спать не менее 7 часов в сутки и многое-многое другое.Для младшего школьного возраста."Какие бывают дома?,978-5-17-121610-8,48,61.21 х 210 x 5 мм,0.1,"Из книги Леонида Львовича Яхнина ""Какие бывают дома?"" вы узнаете, как устроены разные, порой самые удивительные, жилища: иглу и юрта, русская изба и махалля в Средней Азии, японский бумажный дом, прибрежные восточные поселения на сваях, а также фантастические дома будущего. Для младшего школьного возраста."Какие бывают животные?,978-5-17-119193-1,32,62 х 210 x 3 мм,0.085,"Эта книга познакомит малышей с самыми разными животными и птицами: кто бегает быстрее всех на свете? Сколько зубов у крокодила? У кого самые большие глаза? Вас ждут удивительные факты о животных, чудесные иллюстрации и... интрига на каждой странице!Для младшего школьного возраста."Какие бывают насекомые?,978-5-17-120480-8,32,62 х 210 x 3 мм,0.085,"Думаешь, насекомых можно встретить лишь на лесной поляне? Как бы не так! Они окружают нас всюду, крошечные и очень необычные. Они поражают своими суперспособностями, прекрасным или пугающим внешним видом, умением жить в невероятно холодном и жарком климате. Некоторые из них даже побывали в космосе! О том, какая бабочка самая большая в мире, для чего танцуют пчёлы, кто такие жуки плавунцы и сколько глаз у стрекозы, расскажет эта книга.     Для младшего школьного возраста."Когда жили динозавры?,978-5-17-119194-8,32,60 х 210 x 3 мм,0.084,"Эта книга познакомит малышей с самыми разными динозаврами: гигантами апатозавром и маменчизавром, малютками вроде компсогната, ящерами-летунами: птеродактилем и птеранодоном... Множество удивительных фактов о динозаврах, чудесные иллюстрации и... интрига на каждой странице!Хочешь узнать о динозаврах что-нибудь новенькое? Тогда вперёд!Для младшего школьного возраста."Кто живёт на дне морском?,978-5-17-120481-5,32,62 х 210 x 3 мм,0.085,"Океаны и моря полны загадочных существ, каких на суше не встретишь. Тут и великаны-киты, и быстрые акулы, и грациозные морские черепахи, длиннорогие нарвалы, дельфины, тюлени, осьминоги и морские коньки! А знаешь ли ты, что у многих рыб есть профессии? Есть рыбы клоуны и рыбы чистильщики, а ещё ужасная рыба удильщик… Хочешь узнать больше? Скорее открывай книгу!"Лисья сказка,978-5-17-109966-4,48,03 х 264 x 10 мм,0.42,"Сказка приходит в нашу жизнь иногда так неожиданно! Она возвращает краски, дарит любимых людей и даже меняет профессию. Надо только уметь увидеть и впустить её к себе в дом. Пусть даже в виде двух милых рыжих лисичек, выпрыгнувших из … старинных часов. И всё вмиг закрутится и изменится навсегда!    Ещё одна волшебная и очень уютная сказка от признанного мастера авторской книги, лауреата престижных премий в области литературы и графики Дарьи Герасимовой ждёт вас на страницах этой книги. Уникальное сочетание неповторимых и любимых многими лоскутных иллюстраций Даши и совершенно новой и динамичной истории с весёлыми цирковыми жителями и лисами не оставит равнодушными ни детей, ни взрослых."Логопедический альбом малыша,978-5-17-120312-2,48,25 х 162 x 5 мм,0.125,"                                                                                            О чем эта книгаАльбом для дошколят разработан О.А. Новиковской — талантливым педагогом, логопедом  высшей категории, автором более сотни публикаций и книг, посвященных развивающему обучению детей от года до восьми лет.     Кому эта книга будет интереснаАльбом по развитию речи разработан в помощь родителям и педагогам, книга предназначена для совместных занятий взрослого  и ребенка.Каковы особенности этой книги  • Уникальная авторская методика развития речи от логопеда-практика О.А. Новиковской позволит родителям познакомить малышей с буквами алфавита, научить их правильно произносить звуки родной речи.• Интересные задания подобраны с учетом возрастных особенностей детей раннего возраста.• Большое внимание уделено описанию игр с буквами и звуками.• Разнообразные и интересные задания с красочными рисунками сделают развитие речи ребенка доступным и увлекательным.                                                                                    "Лучшие сказки и песенки от года до пяти,978-5-17-121940-6,192,05 х 265 x 20 мм,0.765,"Первую сказку Корней Чуковский написал почти случайно, пытаясь отвлечь заболевшего сына. Потом на свет появились произведения ""Мойдодыр"", ""Тараканище"" и ""Бармалей. Однако не всем эти сказки понравились: критики и редакторы вслед за Н.К. Крупской их разругали, придумав для необычных сказок специальный термин – ""чуковщина"". Однако эти сказки пережили не только критиков, но и самого автора, и живы до сих пор.     В книгу вошли сказки ""Муха-Цокотуха"", ""Федорино горе"", ""Телефон"", ""Чудо-дерево"", ""Путаница"", ""Айболит"" и другие.     Иллюстрации Сергея Бордюга и Надежды Трепенок.     Для дошкольного возраста."Манюня пишет фантастичЫскЫй роман,978-5-17-099849-4,352,30 х 205 x 20 мм,0.301,"Перед вами долгожданное продолжение лучшей в мире книги о детстве — романа Наринэ Абгарян ""Манюня"".Всем, кто уже успел узнать и полюбить смешных подружек-хулиганок Нару и Манюню, суровую, но обаятельную Ба — ба­бушку Манюни и ораву их шумных и несуразных родственни­ков, а также тем, кому это ужасно приятное знакомство только предстоит, мы дарим книжку о новых приключениях Маню­ни! Если вы думаете, что знаете, на что способны две девчон­ки младшего школьного возраста, которым не сидится на ме­сте и хочется провести детство так, чтобы ни одна его минута не прошла скучно, то вы еще ничего не знаете... Читайте и ужасайтесь, то есть наслаждайтесь, конечно!""Манюня, юбилей Ба и прочие треволнения",978-5-17-102190-0,352,30 х 207 x 21 мм,0.313,"Вы держите в руках новую (и, по словам автора, точно последнюю) книгу о приключениях Манюни, Нарки и прочих за­мечательных жителей маленького городка Берд. Спешите видеть! И читать.""Любая история имеет свое начало и свой конец.Перед вами — третья, заключительная книга о девочке Манюне и прочих ее друзьях-родственниках.Это большое счастье, когда история одной семьи находит отклик в сердцах стольких людей.Мы хотим поблагодарить вас за то, что вы были с нами.Спасибо за ваши улыбки и распахнутые сердца.Мы этого не забудем никогда.Герои ""Манюни"""Мастер и Маргарита,978-5-17-112130-3,512,22 х 186 x 35 мм,0.4,"                                                                                            «Выявить подлинный творческий замысел Булгакова, воплощенный в романе „Мастер и Маргарита“, пока ни одному критику не удалось — у каждого критика — „свой“ Булгаков, как и у каждого читателя» © Отечественный литературовед Виктор ПетелинСудьба культового романа советского писателя Михаила Булгакова «Мастер и Маргарита» была сложной. Он создавался более десяти лет, а впервые был издан без цензурных купюр только в 1967 году.«Мастер и Маргарита» — произведение, в котором каждый читатель найдет близкое ему. Здесь есть реализм и мистика, сатира на советскую жизнь 30-х годов и глубокая религиозная философия. Есть детективные мотивы (смерть Берлиоза и загадка появления Воланда в Москве), история любви Мастера и Маргариты и авантюрные перипетии (история Степы Лиходеева и Геллы).Роман многократно ставили в кино и театре. Первый в нашей стране спектакль по «Мастеру и Маргарите» поставил в 1977 году культовый режиссер Юрий Любимов. В России роман был экранизирован дважды — в 1994 году Юрием Карой и в 2005-м Владимиром Бортко, который снял 12-серийный фильм. В этих фильмах сыграли выдающиеся отечественные актеры Михаил Ульянов, Валентин Гафт, Анастасия Вертинская, Олег Басилашвили, Александр Абдулов.                                                                                    "Маус,978-5-17-080250-0,296,70 х 240 x 27 мм,0.817,"""Маус"" Арта Шпигельмана - единственный графический роман, получивший престижную Пулитцеровскую премию.										Автору удалось, казалось бы, невозможное - рассказать историю Холокоста в форме комикса.										Владек Шпигельман, отец Арта, рассказывает сыну, как прошел через гетто, Освенцим и ""марш смерти"" на Дахау.										Но ""Маус"" - это и глубоко личная история, его попытка разобраться в своих непростых отношениях с семьей.										На стыке этих историй и рождается уникальный текст, который без упрощения и пафоса рассказывает										об одной из самых чудовищных трагедий ХХ века."Мои первые прописи после букваря,978-5-17-081847-1,80,97 х 255 x 5 мм,0.184,"Перед вами прописи, составленные специально для дошкольников, которые учатся или уже умеют читать. Мы предлагаем туже последовательность изучения, что используется в букварях. Это сделано не случайно: проще всего запоминается то, что уже знакомо. С первых занятий ваш малыш сможет сразу написать и прочитать первые слова, что обязательно придаст ему уверенность и вызовет интерес к чтению."Мои первые школьные прописи. В 4 ч. Ч. 1,978-5-17-069120-3,32,65 х 210 x 2 мм,0.053,"""Мои первые школьные прописи"" - пособие с поурочным планированием, состоящее из  4-х частей.       Представленные задания - ""обведи элементы букв"", ""пропиши букву"", ""выдели орфограмму"", списывание с печатного текста, письмо под диктовку - необходимы для отработки каллиграфического почерка и развития мелкой моторики.        Каждая буква алфавита дана в виде нескольких простых элементов. На первом этапе ученик обводит напечатаные элементы букв, затем пишет их самостоятельно. Работа по этим прописям даёт очень высокие результаты.       Прописи можно использовать для коллективной работы в классе и для индивидуальной работы дома."Мои первые школьные прописи. В 4 ч. Ч. 2,978-5-17-069121-0,32,65 х 211 x 2 мм,0.055,"""Мои первые школьные прописи"" - пособие с поурочным планированием, состоящее из  4-х частей.       Представленные задания - ""обведи элементы букв"", ""пропиши букву"", ""выдели орфограмму"", списывание с печатного текста, письмо под диктовку - необходимы для отработки каллиграфического почерка и развития мелкой моторики.        Каждая буква алфавита дана в виде нескольких простых элементов. На первом этапе ученик обводит напечатаные элементы букв, затем пишет их самостоятельно. Работа по этим прописям даёт очень высокие результаты.       Прописи можно использовать для коллективной работы в классе и для индивидуальной работы дома."Мои первые школьные прописи. В 4 ч. Ч. 3,978-5-17-069827-1,32,65 х 210 x 2 мм,0.054,"""Мои первые школьные прописи"" - пособие с поурочным планированием, состоящее из  4-х частей.   Представленные задания - ""обведи элементы букв"", ""пропиши букву"", ""выдели орфограмму"", списывание с печатного текста, письмо под диктовку - необходимы для отработки каллиграфического почерка и развития мелкой моторики. Каждая буква алфавита дана в виде нескольких простых элементов. На первом этапе ученик обводит напечатаные элементы букв, затем пишет их самостоятельно. Работа по этим прописям даёт очень высокие результаты. Прописи можно использовать для коллективной работы в классе и для индивидуальной работы дома."